7.41283632975778E+017,https://twitter.com/CatalystCouncil/status/741283632975777792,"Characteristics of hepatocellular carcinoma in cats: Goussev SA, Center SA, et al. Clinical c... https://t.co/DE2ScwuHKv via @WinnFeline",2016-06-10 14:59 +0000,640,1,0.0015625,0,0,0,0,1,0,0,0,0,0,0,0,0,0,0,-,-,-,-,-,-,-,-,-,-,-,-,-,-,-,-,-,-
7.40191371718361E+017,https://twitter.com/CatalystCouncil/status/740191371718361090,"Evaluating sucralfate as a phosphate binder: Quimby J, Lappin M. Evaluating Sucralfate as a P... https://t.co/E0amWm0lLA via @WinnFeline",2016-06-07 14:39 +0000,672,0,0,0,0,0,0,0,0,0,0,0,0,0,0,0,0,0,-,-,-,-,-,-,-,-,-,-,-,-,-,-,-,-,-,-
7.39181928079839E+017,https://twitter.com/CatalystCouncil/status/739181928079839232,CATalyst and the No Mess Pet Dish are partnering at the #Seattle #Pet Expo this weekend! Come join the fun!😻🎉 https://t.co/EFCcfUNKPb,2016-06-04 19:47 +0000,841,6,0.0071343639,0,0,2,0,0,0,4,0,0,0,0,0,0,0,0,-,-,-,-,-,-,-,-,-,-,-,-,-,-,-,-,-,-
7.38745512786989E+017,https://twitter.com/CatalystCouncil/status/738745512786989056,"Analysis of commercially available enteral diets for cats: Prantil LR, Markovich JE, Heinze C... https://t.co/8866z5qlil via @WinnFeline",2016-06-03 14:53 +0000,670,0,0,0,0,0,0,0,0,0,0,0,0,0,0,0,0,0,-,-,-,-,-,-,-,-,-,-,-,-,-,-,-,-,-,-
7.3844262593461E+017,https://twitter.com/CatalystCouncil/status/738442625934610433,Come see us at Booth 205 at the #Seattle Pet Expo this Saturday! Stay tuned for info about our #AskaVet section! https://t.co/uMd3GIpazZ,2016-06-02 18:50 +0000,943,3,0.0031813362,0,0,2,0,0,0,0,0,0,0,0,0,0,1,1,-,-,-,-,-,-,-,-,-,-,-,-,-,-,-,-,-,-
7.37657868342596E+017,https://twitter.com/CatalystCouncil/status/737657868342595585,"Safety of omeprazole antacid in cats: Gould E, Clements C, Reed A. et al.  A Prospective, Pla... https://t.co/NkG0RThzM3 via @WinnFeline",2016-05-31 14:51 +0000,712,2,0.0028089888,0,0,0,0,2,0,0,0,0,0,0,0,0,0,0,-,-,-,-,-,-,-,-,-,-,-,-,-,-,-,-,-,-
7.36222432093217E+017,https://twitter.com/CatalystCouncil/status/736222432093216768,Taking a long Memorial Day weekend? What to do for your cat before going on vacation: https://t.co/JU061eM1pb https://t.co/I1McQmcahf,2016-05-27 15:48 +0000,765,6,0.0078431373,0,0,1,0,3,0,1,0,0,0,0,0,0,1,1,-,-,-,-,-,-,-,-,-,-,-,-,-,-,-,-,-,-
7.36197916428116E+017,https://twitter.com/CatalystCouncil/status/736197916428115968,"Genetics and osteochondrodysplasia in Scottish fold cats: Gandolfi B, Alamri S, Darby WG, et ... https://t.co/wt00P1DjTU via @WinnFeline",2016-05-27 14:10 +0000,671,0,0,0,0,0,0,0,0,0,0,0,0,0,0,0,0,0,-,-,-,-,-,-,-,-,-,-,-,-,-,-,-,-,-,-
7.35504607728783E+017,https://twitter.com/CatalystCouncil/status/735504607728783360,What's the appropriate amount of time to grieve the loss of a #cat? Spoiler alert: as much time as you need. https://t.co/XDfqr1S42J,2016-05-25 16:15 +0000,871,15,0.0172215844,2,0,6,1,5,0,1,0,0,0,0,0,0,0,0,-,-,-,-,-,-,-,-,-,-,-,-,-,-,-,-,-,-
7.35142119183094E+017,https://twitter.com/CatalystCouncil/status/735142119183093761,Our very own Jane Brunt and Dr. Tony Buffington contribute to the conversation about dealing with feline aggression: https://t.co/X0sThRV0RC,2016-05-24 16:15 +0000,631,5,0.0079239303,0,0,1,0,4,0,0,0,0,0,0,0,0,0,0,-,-,-,-,-,-,-,-,-,-,-,-,-,-,-,-,-,-
7.35117449448722E+017,https://twitter.com/CatalystCouncil/status/735117449448722432,"A delicate balance:  thyroid and renal function: Vaske HH, Schermerhorn T, Grauer GF.  Effect... https://t.co/p4KaIsqdVj via @WinnFeline",2016-05-24 14:37 +0000,658,4,0.0060790274,2,0,1,0,1,0,0,0,0,0,0,0,0,0,0,-,-,-,-,-,-,-,-,-,-,-,-,-,-,-,-,-,-
7.33720730584637E+017,https://twitter.com/CatalystCouncil/status/733720730584637444,"Weekend plans set. (Disclaimer: CATalyst Council does not endorse the act of cat theft, even for really cute ones) https://t.co/y2Vkbr8aPI",2016-05-20 18:07 +0000,604,1,0.0016556291,0,0,0,0,1,0,0,0,0,0,0,0,0,0,0,-,-,-,-,-,-,-,-,-,-,-,-,-,-,-,-,-,-
7.33680911003189E+017,https://twitter.com/CatalystCouncil/status/733680911003189250,Cat Personality Structure: Implications for environmental enrichment and emotional care: Gart... https://t.co/l0mQgLuFqn via @WinnFeline,2016-05-20 15:28 +0000,574,2,0.0034843206,0,0,0,1,1,0,0,0,0,0,0,0,0,0,0,-,-,-,-,-,-,-,-,-,-,-,-,-,-,-,-,-,-
7.33328917478707E+017,https://twitter.com/CatalystCouncil/status/733328917478707200,Tips for improved cohabitation when you live with both allergies and #pets: https://t.co/K2dk8wOwO2,2016-05-19 16:10 +0000,561,1,0.0017825312,0,0,0,0,1,0,0,0,0,0,0,0,0,0,0,-,-,-,-,-,-,-,-,-,-,-,-,-,-,-,-,-,-
7.32577785210802E+017,https://twitter.com/CatalystCouncil/status/732577785210802177,Enteric E. coli infection in kittens - a risk to kittens:  Enteropathogenic E. coli infection... https://t.co/YERuqURkQZ via @WinnFeline,2016-05-17 14:25 +0000,505,0,0,0,0,0,0,0,0,0,0,0,0,0,0,0,0,0,-,-,-,-,-,-,-,-,-,-,-,-,-,-,-,-,-,-
7.31246940478919E+017,https://twitter.com/CatalystCouncil/status/731246940478918656,Do you have the good fortune of spending this Friday the 13th with a black cat? https://t.co/ecCEk7WpXU,2016-05-13 22:17 +0000,538,3,0.0055762082,0,0,0,0,3,0,0,0,0,0,0,0,0,0,0,-,-,-,-,-,-,-,-,-,-,-,-,-,-,-,-,-,-
7.31136124844806E+017,https://twitter.com/CatalystCouncil/status/731136124844806146,"Knowing about feline environmental enrichment: Alho AM, Pontes J, Pomba C. Guardians’ Knowled... https://t.co/jjRhkpt4LO via @WinnFeline",2016-05-13 14:56 +0000,505,4,0.0079207921,0,0,2,0,2,0,0,0,0,0,0,0,0,0,0,-,-,-,-,-,-,-,-,-,-,-,-,-,-,-,-,-,-
7.30473862375297E+017,https://twitter.com/CatalystCouncil/status/730473862375297025,Are you graced with a senior kitty at home? It's important to be vigilant and know what to expect as your cat ages: https://t.co/2gUE3e3y7b,2016-05-11 19:05 +0000,563,15,0.026642984,1,0,2,2,6,0,4,0,0,0,0,0,0,0,0,-,-,-,-,-,-,-,-,-,-,-,-,-,-,-,-,-,-
7.30428544740905E+017,https://twitter.com/CatalystCouncil/status/730428544740904961,The world's oldest feline has made it 30 years by the side of one dedicated &amp; loving owner: https://t.co/nqMNDv51sg https://t.co/sZImTlYTT8,2016-05-11 16:05 +0000,576,19,0.0329861111,2,0,5,1,10,0,1,0,0,0,0,0,0,0,0,-,-,-,-,-,-,-,-,-,-,-,-,-,-,-,-,-,-
7.3005085179279E+017,https://twitter.com/CatalystCouncil/status/730050851792789504,"Axillary temperature measurement in cats: Girod M, Vandenheede M, et al. Axillary temperature... https://t.co/wSwm7PmvVK via @WinnFeline",2016-05-10 15:04 +0000,429,0,0,0,0,0,0,0,0,0,0,0,0,0,0,0,0,0,-,-,-,-,-,-,-,-,-,-,-,-,-,-,-,-,-,-
7.29750346772431E+017,https://twitter.com/CatalystCouncil/status/729750346772430848,Canadian animal protection laws could be strengthened by a new bill to be discussed in the House of Commons today: https://t.co/aCpg9pHmSP,2016-05-09 19:10 +0000,647,0,0,0,0,0,0,0,0,0,0,0,0,0,0,0,0,0,-,-,-,-,-,-,-,-,-,-,-,-,-,-,-,-,-,-
7.28587403527479E+017,https://twitter.com/CatalystCouncil/status/728587403527479301,Predicting the site of histopathological abnormalities of the alimentary tract in cats: Frech... https://t.co/jpYMnu45wo via @WinnFeline,2016-05-06 14:09 +0000,501,3,0.005988024,0,0,1,0,2,0,0,0,0,0,0,0,0,0,0,-,-,-,-,-,-,-,-,-,-,-,-,-,-,-,-,-,-
7.27917976196895E+017,https://twitter.com/CatalystCouncil/status/727917976196894721,Don’t underestimate the purr of the dark side. #starwars #pawwars #may4th #cats https://t.co/CYR0pg773b,2016-05-04 17:49 +0000,507,1,0.0019723866,0,0,0,0,0,1,0,0,0,0,0,0,0,0,0,-,-,-,-,-,-,-,-,-,-,-,-,-,-,-,-,-,-
7.27530702007353E+017,https://twitter.com/CatalystCouncil/status/727530702007353345,Animals teach countless important character concepts. Bring these to the classroom with @HumaneSociety lesson plans: https://t.co/PzyHk2pAik,2016-05-03 16:10 +0000,537,2,0.0037243948,0,1,0,0,1,0,0,0,0,0,0,0,0,0,0,-,-,-,-,-,-,-,-,-,-,-,-,-,-,-,-,-,-
7.2751323102396E+017,https://twitter.com/CatalystCouncil/status/727513231023960064,"A test for the neurological form of FIP?: Doings SJ, Weber K, et al. Detection of feline coro... https://t.co/ikQxgTFsoB via @WinnFeline",2016-05-03 15:00 +0000,493,0,0,0,0,0,0,0,0,0,0,0,0,0,0,0,0,0,-,-,-,-,-,-,-,-,-,-,-,-,-,-,-,-,-,-
7.27213621202325E+017,https://twitter.com/CatalystCouncil/status/727213621202325505,Did you have a classroom #pet? The benefits of a classroom animal are many and meaningful: https://t.co/RuDHi3OA7I https://t.co/gS81zYFLpQ,2016-05-02 19:10 +0000,497,1,0.0020120724,0,0,1,0,0,0,0,0,0,0,0,0,0,0,0,-,-,-,-,-,-,-,-,-,-,-,-,-,-,-,-,-,-
7.27163357762052E+017,https://twitter.com/CatalystCouncil/status/727163357762052100,#Portland has a wide selection of activities where you can get your #cat fix. Plan the purrrfect weekend right meow: https://t.co/68KxhoxHZl,2016-05-02 15:50 +0000,515,0,0,0,0,0,0,0,0,0,0,0,0,0,0,0,0,0,-,-,-,-,-,-,-,-,-,-,-,-,-,-,-,-,-,-
7.26796865849709E+017,https://twitter.com/CatalystCouncil/status/726796865849708544,Learn about the tradition of Be Kind to Animals Week (May 1-7) and how you can recognize it: https://t.co/pUj419Nboe https://t.co/6hGE50mz2Z,2016-05-01 15:34 +0000,512,4,0.0078125,0,0,0,0,4,0,0,0,0,0,0,0,0,0,0,-,-,-,-,-,-,-,-,-,-,-,-,-,-,-,-,-,-
7.26777609837797E+017,https://twitter.com/CatalystCouncil/status/726777609837797377,"RT @BlindCatRescue: What a sweet story about some kittens being found and rescued.
Hope you enjoy. https://t.co/RNPqCQMfha",2016-05-01 14:17 +0000,494,4,0.008097166,0,0,0,0,4,0,0,0,0,0,0,0,0,0,0,-,-,-,-,-,-,-,-,-,-,-,-,-,-,-,-,-,-
7.26775443421061E+017,https://twitter.com/CatalystCouncil/status/726775443421061120,RT @MerckAH: It’s National Pet Week! Learn about the basics for a Lifetime of Love: https://t.co/6wdDkPKmLF #PetWeek https://t.co/PHWKJvudVJ,2016-05-01 14:09 +0000,509,1,0.0019646365,0,0,0,0,1,0,0,0,0,0,0,0,0,0,0,-,-,-,-,-,-,-,-,-,-,-,-,-,-,-,-,-,-
7.26452207256621E+017,https://twitter.com/CatalystCouncil/status/726452207256621057,Celebrate National Tabby Day by Adventuring with One Extraordinary Tabby https://t.co/jDZflMBcTN https://t.co/2L4xrKHfS6,2016-04-30 16:44 +0000,613,21,0.0342577488,1,0,2,3,4,0,5,0,0,0,0,0,0,6,6,-,-,-,-,-,-,-,-,-,-,-,-,-,-,-,-,-,-
7.26173494661272E+017,https://twitter.com/CatalystCouncil/status/726173494661271552,More than one or two hairballs a year is not normal. Do you know what is? https://t.co/Q4nMcKuZf4 https://t.co/80AqaQM5gF,2016-04-29 22:17 +0000,690,4,0.0057971014,1,0,0,0,3,0,0,0,0,0,0,0,0,0,0,-,-,-,-,-,-,-,-,-,-,-,-,-,-,-,-,-,-
7.26062004918583E+017,https://twitter.com/CatalystCouncil/status/726062004918583296,"Feline Morbillivirus in the Cats in the United States:  Sharp CR, Nambulli S, Acciardo AS, et... https://t.co/XAdII36HiG via @WinnFeline",2016-04-29 14:54 +0000,539,2,0.0037105751,0,0,1,0,1,0,0,0,0,0,0,0,0,0,0,-,-,-,-,-,-,-,-,-,-,-,-,-,-,-,-,-,-
7.25040569068716E+017,https://twitter.com/CatalystCouncil/status/725040569068716032,WA state program pairs shelter #cats &amp; special needs students to brighten the lives &amp; futures of both: https://t.co/QrL2eUYNmf @HABRITweets,2016-04-26 19:15 +0000,1294,8,0.0061823802,2,0,4,0,2,0,0,0,0,0,0,0,0,0,0,-,-,-,-,-,-,-,-,-,-,-,-,-,-,-,-,-,-
7.24980770792571E+017,https://twitter.com/CatalystCouncil/status/724980770792570880,"Risk Factors for Development of Chronic Kidney Disease in Cats: Finch NC, Syme HM, Elliott J.... https://t.co/RwVz57mHQK via @WinnFeline",2016-04-26 15:17 +0000,562,3,0.0053380783,0,0,1,0,2,0,0,0,0,0,0,0,0,0,0,-,-,-,-,-,-,-,-,-,-,-,-,-,-,-,-,-,-
7.24651228270043E+017,https://twitter.com/CatalystCouncil/status/724651228270043136,Tomorrow is National Kids and Pets day! Promote the human-animal bond by sharing your best #cats &amp; #kids stories! 😻 https://t.co/DIrORFPrig,2016-04-25 17:28 +0000,602,0,0,0,0,0,0,0,0,0,0,0,0,0,0,0,0,0,-,-,-,-,-,-,-,-,-,-,-,-,-,-,-,-,-,-
7.23588505071399E+017,https://twitter.com/CatalystCouncil/status/723588505071398918,Have kiddies and kitties at home? How to facilitate positive interactions from a young age: https://t.co/vrtojtUH8l https://t.co/zCs4084z9Z,2016-04-22 19:05 +0000,655,3,0.0045801527,2,0,0,0,1,0,0,0,0,0,0,0,0,0,0,-,-,-,-,-,-,-,-,-,-,-,-,-,-,-,-,-,-
7.23542017221992E+017,https://twitter.com/CatalystCouncil/status/723542017221992449,4 ways to improve your relationship with your #cat you can do today: https://t.co/neLCxWTIrT https://t.co/xk6ogaWsaY,2016-04-22 16:00 +0000,528,1,0.0018939394,0,0,0,0,1,0,0,0,0,0,0,0,0,0,0,-,-,-,-,-,-,-,-,-,-,-,-,-,-,-,-,-,-
7.2352448706544E+017,https://twitter.com/CatalystCouncil/status/723524487065440257,Follow-up on long-term antiretroviral therapy for cats infected with feline immunodeficiency v... https://t.co/I41Uesu0Vy via @WinnFeline,2016-04-22 14:50 +0000,652,4,0.0061349693,1,0,2,0,1,0,0,0,0,0,0,0,0,0,0,-,-,-,-,-,-,-,-,-,-,-,-,-,-,-,-,-,-
7.22906481440338E+017,https://twitter.com/CatalystCouncil/status/722906481440337920,Amazing acts for #cats: A Bronx cat has been returned safely home after a Bronx man risked his life for the feat: https://t.co/wMLzHrlPgf,2016-04-20 21:55 +0000,830,6,0.0072289157,2,0,1,0,2,0,1,0,0,0,0,0,0,0,0,-,-,-,-,-,-,-,-,-,-,-,-,-,-,-,-,-,-
7.22440552361267E+017,https://twitter.com/CatalystCouncil/status/722440552361267200,"What does whole genome sequencing have to do with blind and bobtailed cats?: Lyons LA, Creight... https://t.co/UQcdpOyLZR via @WinnFeline",2016-04-19 15:03 +0000,694,10,0.0144092219,2,0,2,0,6,0,0,0,0,0,0,0,0,0,0,-,-,-,-,-,-,-,-,-,-,-,-,-,-,-,-,-,-
7.22094884308574E+017,https://twitter.com/CatalystCouncil/status/722094884308574210,Proper pet ID helps your furry friends return safely home. How to choose the right collar and tag for your #cat: https://t.co/mahanRyVJW,2016-04-18 16:10 +0000,610,1,0.0016393443,0,0,0,0,0,0,1,0,0,0,0,0,0,0,0,-,-,-,-,-,-,-,-,-,-,-,-,-,-,-,-,-,-
7.21370098427175E+017,https://twitter.com/CatalystCouncil/status/721370098427174912,"To tell you I’m ready to come through the door. No wait, just kidding, I’m ready no moooore... #cats #catsaturday https://t.co/9U1PLvfwwZ",2016-04-16 16:10 +0000,648,4,0.0061728395,1,0,0,0,3,0,0,0,0,0,0,0,0,0,0,-,-,-,-,-,-,-,-,-,-,-,-,-,-,-,-,-,-
7.20989153425404E+017,https://twitter.com/CatalystCouncil/status/720989153425403904,Cardiomyopathy in Birman cats: W15-055   Phenotypic characterization of cardiomyopathy in Birm... https://t.co/fATfIAB0bC via @WinnFeline,2016-04-15 14:56 +0000,914,7,0.0076586433,2,0,0,0,2,0,3,0,0,0,0,0,0,0,0,-,-,-,-,-,-,-,-,-,-,-,-,-,-,-,-,-,-
7.2069194473787E+017,https://twitter.com/CatalystCouncil/status/720691944737869826,What does a kidney disease diagnosis mean for your cat and you? Understanding and addressing possible outcomes: https://t.co/OasiEDOiGF,2016-04-14 19:15 +0000,645,3,0.0046511628,0,0,0,0,1,0,2,0,0,0,0,0,0,0,0,-,-,-,-,-,-,-,-,-,-,-,-,-,-,-,-,-,-
7.20641554273198E+017,https://twitter.com/CatalystCouncil/status/720641554273198080,MushMush the #cat is using his second chance at life to make enough friends for all 9 lives: https://t.co/hZvxu6Rcmz https://t.co/9cXdI8ooHq,2016-04-14 15:55 +0000,699,4,0.0057224607,0,0,3,0,1,0,0,0,0,0,0,0,0,0,0,-,-,-,-,-,-,-,-,-,-,-,-,-,-,-,-,-,-
7.19903013448454E+017,https://twitter.com/CatalystCouncil/status/719903013448454144,COMPARING PCR WITH FUNGAL CULTURE FOR DIAGNOSIS OF RINGWORM:  W15-001  A field study to compar... https://t.co/sZ1vsRtUVL via @WinnFeline,2016-04-12 15:00 +0000,677,1,0.0014771049,0,0,0,0,1,0,0,0,0,0,0,0,0,0,0,-,-,-,-,-,-,-,-,-,-,-,-,-,-,-,-,-,-
7.19556953706471E+017,https://twitter.com/CatalystCouncil/status/719556953706471424,Does your pet care include a contingency plan? Documents pet owners should maintain for their furry friends: https://t.co/s2nKMYxHW2,2016-04-11 16:05 +0000,718,3,0.004178273,0,0,1,0,2,0,0,0,0,0,0,0,0,0,0,-,-,-,-,-,-,-,-,-,-,-,-,-,-,-,-,-,-
7.18458182486532E+017,https://twitter.com/CatalystCouncil/status/718458182486532096,"Patent ductus arteriosus in cats: Hutton JE, Steffey MA, et al.  Surgical and nonsurgical mana... https://t.co/DlwsgNCshd via @WinnFeline",2016-04-08 15:19 +0000,716,1,0.001396648,0,0,0,1,0,0,0,0,0,0,0,0,0,0,0,-,-,-,-,-,-,-,-,-,-,-,-,-,-,-,-,-,-
7.18100207133717E+017,https://twitter.com/CatalystCouncil/status/718100207133716482,Animal Control officers contribute great work to a great cause: https://t.co/CwcLuD4moP https://t.co/SEWD8FvJM8,2016-04-07 15:36 +0000,705,2,0.0028368794,0,0,1,0,1,0,0,0,0,0,0,0,0,0,0,-,-,-,-,-,-,-,-,-,-,-,-,-,-,-,-,-,-
7.17743791059378E+017,https://twitter.com/CatalystCouncil/status/717743791059378176,Incredible #Colorado is stepping up for #cats &amp; #dogs in need by providing free wellness &amp; rabies exams April 9-10: https://t.co/NncMNxaoqc,2016-04-06 16:00 +0000,786,10,0.0127226463,2,0,2,0,5,0,1,0,0,0,0,0,0,0,0,-,-,-,-,-,-,-,-,-,-,-,-,-,-,-,-,-,-
7.17374469157757E+017,https://twitter.com/CatalystCouncil/status/717374469157756929,"New hope for a frustrating disease: Arzi B, Mills-Ko E, et al.  Therapeutic efficacy of fresh,... https://t.co/xFNZG2ygTa via @WinnFeline",2016-04-05 15:32 +0000,678,2,0.0029498525,0,0,0,0,2,0,0,0,0,0,0,0,0,0,0,-,-,-,-,-,-,-,-,-,-,-,-,-,-,-,-,-,-
7.16656836125057E+017,https://twitter.com/CatalystCouncil/status/716656836125057024,"Dog people can be cat people, too. 12 #cat-friendly #dog breeds that make purrrfect companions for the whole family: https://t.co/LkqiebMLC2",2016-04-03 16:01 +0000,635,3,0.0047244094,0,0,0,0,3,0,0,0,0,0,0,0,0,0,0,-,-,-,-,-,-,-,-,-,-,-,-,-,-,-,-,-,-
7.16291648930624E+017,https://twitter.com/CatalystCouncil/status/716291648930623488,Almost 60% of #cats are obese. Fight the statistic and keep your kitty healthy with a little cat cardio: https://t.co/0fgEscMkOv,2016-04-02 15:50 +0000,1224,16,0.0130718954,5,0,4,1,6,0,0,0,0,0,0,0,0,0,0,-,-,-,-,-,-,-,-,-,-,-,-,-,-,-,-,-,-
7.16236259367207E+017,https://twitter.com/CatalystCouncil/status/716236259367206912,UK police force considers leading the way in feline officers after receiving the suggestion from a young #cat lover: https://t.co/8EBD0SYltc,2016-04-02 12:10 +0000,716,10,0.0139664804,1,0,1,0,8,0,0,0,0,0,0,0,0,0,0,-,-,-,-,-,-,-,-,-,-,-,-,-,-,-,-,-,-
7.15912880156242E+017,https://twitter.com/CatalystCouncil/status/715912880156241920,"Feline panleukopenia virus in nerve cells of cats: Garigliany M, Gilliaux G, et al. Feline pan... https://t.co/MhzZvFQ0F2 via @WinnFeline",2016-04-01 14:45 +0000,665,4,0.0060150376,0,0,2,0,2,0,0,0,0,0,0,0,0,0,0,-,-,-,-,-,-,-,-,-,-,-,-,-,-,-,-,-,-
7.14828077797216E+017,https://twitter.com/CatalystCouncil/status/714828077797216256,"Effect of anti-feline TNF-alpha antibody for FIP: Loki T, Takano T, et al. Therapeutic effect ... https://t.co/hIjRkZT1vw via @WinnFeline",2016-03-29 14:54 +0000,635,2,0.0031496063,0,0,1,0,1,0,0,0,0,0,0,0,0,0,0,-,-,-,-,-,-,-,-,-,-,-,-,-,-,-,-,-,-
7.14527959374234E+017,https://twitter.com/CatalystCouncil/status/714527959374233601,Your #cats don't have to miss out on all the holiday fun; easy #DIY cat toys to make and share this #Easter: https://t.co/LURiq0A0He,2016-03-28 19:01 +0000,646,1,0.0015479876,0,0,0,1,0,0,0,0,0,0,0,0,0,0,0,-,-,-,-,-,-,-,-,-,-,-,-,-,-,-,-,-,-
7.14481029717869E+017,https://twitter.com/CatalystCouncil/status/714481029717868546,"Friendly reminder that lilies, candies, and other #Easter delights are for kiddies and NOT kitties! https://t.co/SrTm1wId27 #Cats",2016-03-28 15:55 +0000,653,4,0.0061255743,0,0,4,0,0,0,0,0,0,0,0,0,0,0,0,-,-,-,-,-,-,-,-,-,-,-,-,-,-,-,-,-,-
7.13437851808084E+017,https://twitter.com/CatalystCouncil/status/713437851808083968,Encourage exercise and discourage wandering by creating enrichment for your #cat outdoors; https://t.co/ZARjLzMzV3 https://t.co/07eRVH1zGS,2016-03-25 18:50 +0000,1054,6,0.0056925996,2,0,0,1,3,0,0,0,0,0,0,0,0,0,0,-,-,-,-,-,-,-,-,-,-,-,-,-,-,-,-,-,-
7.13383635190096E+017,https://twitter.com/CatalystCouncil/status/713383635190095872,"Temperature taking methods for cats: Smith VA, Lamb V, McBrearty AR. Comparison of axillary, t... https://t.co/TUBim9aONn via @WinnFeline",2016-03-25 15:14 +0000,607,2,0.0032948929,0,0,0,0,2,0,0,0,0,0,0,0,0,0,0,-,-,-,-,-,-,-,-,-,-,-,-,-,-,-,-,-,-
7.12729611017265E+017,https://twitter.com/CatalystCouncil/status/712729611017265152,@AVMAvets gives us another incredible resource for the latest in feline health https://t.co/Uta7Lg3eA7 #Cats #SmartBrief,2016-03-23 19:55 +0000,208,2,0.0096153846,1,0,0,0,1,0,0,0,0,0,0,0,0,0,0,-,-,-,-,-,-,-,-,-,-,-,-,-,-,-,-,-,-
7.12714333227192E+017,https://twitter.com/CatalystCouncil/status/712714333227192320,Care tips for #cats this season from moulting to breeding and other health concerns: https://t.co/8dGNfxELfr https://t.co/pEevcnKdjt,2016-03-23 18:55 +0000,591,2,0.0033840948,0,0,0,0,2,0,0,0,0,0,0,0,0,0,0,-,-,-,-,-,-,-,-,-,-,-,-,-,-,-,-,-,-
7.12296897931649E+017,https://twitter.com/CatalystCouncil/status/712296897931649025,"What are cat owners feeding and giving as medications to cats with CKD?: Markovich JE, Freeman... https://t.co/c694jLUUTa via @WinnFeline",2016-03-22 15:16 +0000,548,4,0.0072992701,0,0,0,0,3,0,1,0,0,0,0,0,0,0,0,-,-,-,-,-,-,-,-,-,-,-,-,-,-,-,-,-,-
7.11992100590633E+017,https://twitter.com/CatalystCouncil/status/711992100590632960,"Before planting your garden, know which plants are safe for your feline to frolic: https://t.co/3zOLBYENSe https://t.co/qZhTC8fX7M",2016-03-21 19:05 +0000,568,3,0.0052816901,1,0,1,0,1,0,0,0,0,0,0,0,0,0,0,-,-,-,-,-,-,-,-,-,-,-,-,-,-,-,-,-,-
7.10864471921545E+017,https://twitter.com/CatalystCouncil/status/710864471921545216,National Poison Prevention Awareness Week https://t.co/xZRf8RsSrR https://t.co/YqG3RjzFZY,2016-03-18 16:24 +0000,2145,10,0.0046620047,4,0,3,0,3,0,0,0,0,0,0,0,0,0,0,-,-,-,-,-,-,-,-,-,-,-,-,-,-,-,-,-,-
7.1080333854824E+017,https://twitter.com/CatalystCouncil/status/710803338548240385,"A rapid and safe method for a feline spay: Miller KP, Rekers W, Ellis K, Ellingsen K, Milovanc... https://t.co/AICyESoymC via @WinnFeline",2016-03-18 12:21 +0000,473,2,0.0042283298,0,0,0,0,2,0,0,0,0,0,0,0,0,0,0,-,-,-,-,-,-,-,-,-,-,-,-,-,-,-,-,-,-
7.10582807635075E+017,https://twitter.com/CatalystCouncil/status/710582807635075073,The luck of the #cat exists in many forms around the world. See what your feline fortune brings this #StPattysDay: https://t.co/LKcslbDJhm,2016-03-17 21:45 +0000,431,4,0.0092807425,0,0,0,0,2,1,1,0,0,0,0,0,0,0,0,-,-,-,-,-,-,-,-,-,-,-,-,-,-,-,-,-,-
7.10541437104955E+017,https://twitter.com/CatalystCouncil/status/710541437104955392,"To celebrate St. Patty's, here are some poetic tabbys. Limericks written by #cats, what d'ya think about that? https://t.co/bD8JnSe0sF",2016-03-17 19:00 +0000,434,0,0,0,0,0,0,0,0,0,0,0,0,0,0,0,0,0,-,-,-,-,-,-,-,-,-,-,-,-,-,-,-,-,-,-
7.10180154409144E+017,https://twitter.com/CatalystCouncil/status/710180154409144320,Can you pass the flu to your #pets? Take a sick day with your #cat &amp; read up to keep your pets healthy &amp; virus-free: https://t.co/jRMGQGBWfT,2016-03-16 19:05 +0000,557,7,0.012567325,1,0,2,0,2,2,0,0,0,0,0,0,0,0,0,-,-,-,-,-,-,-,-,-,-,-,-,-,-,-,-,-,-
7.10130940228538E+017,https://twitter.com/CatalystCouncil/status/710130940228538372,Awesome! RT @BlogPaws: A #cat litter that prevents ammonia from forming @LucyPetProducts at #GlobalPetExpo #BlogPaws https://t.co/0u0ewY5yUl,2016-03-16 15:49 +0000,544,14,0.0257352941,0,0,1,2,1,2,3,0,0,0,0,0,0,5,5,-,-,-,-,-,-,-,-,-,-,-,-,-,-,-,-,-,-
7.09758173159141E+017,https://twitter.com/CatalystCouncil/status/709758173159141377,"Changes in thyroid pathology in hyperthyroid cats with disease duration: Peterson ME, Broome M... https://t.co/myCmsS4EKs via @WinnFeline",2016-03-15 15:08 +0000,403,1,0.0024813896,0,0,0,0,1,0,0,0,0,0,0,0,0,0,0,-,-,-,-,-,-,-,-,-,-,-,-,-,-,-,-,-,-
7.09454261541802E+017,https://twitter.com/CatalystCouncil/status/709454261541801984,A new study shows #cats have personality traits similar to humans' Big Five: https://t.co/mXyzptgKe8 https://t.co/us9Lq3X3j2,2016-03-14 19:00 +0000,679,14,0.0206185567,2,0,4,0,5,0,3,0,0,0,0,0,0,0,0,-,-,-,-,-,-,-,-,-,-,-,-,-,-,-,-,-,-
7.08772448376791E+017,https://twitter.com/CatalystCouncil/status/708772448376791040,#cats are great for people- we need more evidence to support the Human Animal Bond Research Initiative #HABRITweets https://t.co/mvHghi5ZMT,2016-03-12 21:51 +0000,560,11,0.0196428571,3,0,5,1,0,0,2,0,0,0,0,0,0,0,0,-,-,-,-,-,-,-,-,-,-,-,-,-,-,-,-,-,-
7.08701633824334E+017,https://twitter.com/CatalystCouncil/status/708701633824333824,Does kitty litter make you bitter? Avoiding these 5 common litter box mistakes will keep you and your #cats happy: https://t.co/rjoUCGDBCA,2016-03-12 17:10 +0000,355,3,0.0084507042,0,0,0,0,1,0,2,0,0,0,0,0,0,0,0,-,-,-,-,-,-,-,-,-,-,-,-,-,-,-,-,-,-
7.08385828339376E+017,https://twitter.com/CatalystCouncil/status/708385828339376128,29 pictures illustrate the incredible impact love has on #cats in need: https://t.co/xbw7aHzEJ5 #FelineFriday https://t.co/8Xv5CDt6ai,2016-03-11 20:15 +0000,370,5,0.0135135135,0,0,2,0,2,0,1,0,0,0,0,0,0,0,0,-,-,-,-,-,-,-,-,-,-,-,-,-,-,-,-,-,-
7.08297795615064E+017,https://twitter.com/CatalystCouncil/status/708297795615064064,"My Cat Hurts?: Merola I, Mills DS. Behavioural Signs of Pain in Cats: An Expert Consensus.  PL... https://t.co/kzcbw91PVb via @WinnFeline",2016-03-11 14:25 +0000,391,2,0.0051150895,1,0,0,0,1,0,0,0,0,0,0,0,0,0,0,-,-,-,-,-,-,-,-,-,-,-,-,-,-,-,-,-,-
7.07210300903141E+017,https://twitter.com/CatalystCouncil/status/707210300903141377,"What do Cats, Mole Rats, and Bats have to do with Aging?: Grimm D. Why we outlive our pets. Sc... https://t.co/kmbLmMEF10 via @WinnFeline",2016-03-08 14:24 +0000,342,1,0.0029239766,0,0,0,0,1,0,0,0,0,0,0,0,0,0,0,-,-,-,-,-,-,-,-,-,-,-,-,-,-,-,-,-,-
7.05790948463084E+017,https://twitter.com/CatalystCouncil/status/705790948463083520,"Safety of robenacoxib in feline osteoarthritis: King, JN, King S, et al.  Clinical safety of r... https://t.co/5wgmwSjugy via @WinnFeline",2016-03-04 16:24 +0000,475,3,0.0063157895,1,0,0,0,2,0,0,0,0,0,0,0,0,0,0,-,-,-,-,-,-,-,-,-,-,-,-,-,-,-,-,-,-
