7.05470506582016E+017,https://twitter.com/CatalystCouncil/status/705470506582016001,Do you have a 'fraidy cat on your hands? How to understand and care for a fearful feline: https://t.co/FB80C1yX0k https://t.co/o2VjcoZDe9,2016-03-03 19:10 +0000,387,4,0.0103359173,0,0,1,0,3,0,0,0,0,0,0,0,0,0,0,-,-,-,-,-,-,-,-,-,-,-,-,-,-,-,-,-,-
7.05162201162715E+017,https://twitter.com/CatalystCouncil/status/705162201162715136,"Donations poured in from all over the country to feed Japan's Aoshima, aka Cat Island: https://t.co/cTqaNu2S0p https://t.co/WI3lwDS0ME",2016-03-02 22:45 +0000,509,5,0.0098231827,1,0,0,0,4,0,0,0,0,0,0,0,0,0,0,-,-,-,-,-,-,-,-,-,-,-,-,-,-,-,-,-,-
7.0508165839179E+017,https://twitter.com/CatalystCouncil/status/705081658391789569,Free-ranging #cats can be an invasive species with major impact. How to keep local wildlife and your #pets safe: https://t.co/ODWq96K9vA,2016-03-02 17:25 +0000,464,0,0,0,0,0,0,0,0,0,0,0,0,0,0,0,0,0,-,-,-,-,-,-,-,-,-,-,-,-,-,-,-,-,-,-
7.04706667234124E+017,https://twitter.com/CatalystCouncil/status/704706667234123780,"Veterinary experts in feline medicine define 25 signs of pain in #cats, allowing for more efficient diagnosis: https://t.co/BwoVwOukyZ",2016-03-01 16:35 +0000,406,2,0.0049261084,0,0,0,0,2,0,0,0,0,0,0,0,0,0,0,-,-,-,-,-,-,-,-,-,-,-,-,-,-,-,-,-,-
7.04692510149325E+017,https://twitter.com/CatalystCouncil/status/704692510149324800,"Feline small cell lymphoma: Pope KE, Tun AE, et al.  Outcome and toxicity assessment of feline... https://t.co/7QKAyNC9dT via @WinnFeline",2016-03-01 15:39 +0000,358,2,0.0055865922,0,0,0,0,2,0,0,0,0,0,0,0,0,0,0,-,-,-,-,-,-,-,-,-,-,-,-,-,-,-,-,-,-
7.04392034048741E+017,https://twitter.com/CatalystCouncil/status/704392034048741376,Its genetic makeup makes the male calico about as rare as #LeapDay. Bust the myths of the true tricolor: https://t.co/3i312PgG2p,2016-02-29 19:45 +0000,465,4,0.0086021505,1,0,1,0,2,0,0,0,0,0,0,0,0,0,0,-,-,-,-,-,-,-,-,-,-,-,-,-,-,-,-,-,-
7.04353006603661E+017,https://twitter.com/CatalystCouncil/status/704353006603661312,Celebrate this rare #LeapDay with these rare and striking cat breeds: https://t.co/r8kv47u7du https://t.co/LkwCWyNYi0,2016-02-29 17:10 +0000,383,5,0.0130548303,0,0,2,0,2,0,1,0,0,0,0,0,0,0,0,-,-,-,-,-,-,-,-,-,-,-,-,-,-,-,-,-,-
7.0324695551891E+017,https://twitter.com/CatalystCouncil/status/703246955518910467,"Serum ionized calcium, prognosis and the clinical course of pancreatitis in cats: Dias C, Carr... https://t.co/64hxtmRJmK via @WinnFeline",2016-02-26 15:55 +0000,404,3,0.0074257426,0,0,0,0,3,0,0,0,0,0,0,0,0,0,0,-,-,-,-,-,-,-,-,-,-,-,-,-,-,-,-,-,-
7.02947509438644E+017,https://twitter.com/CatalystCouncil/status/702947509438644230,"It might sound silly, but #cat videos might be the key to curb youth smoking in a new public health ad: https://t.co/Bt3Jbpmt8Y #CATmageddon",2016-02-25 20:05 +0000,575,8,0.0139130435,1,0,2,1,2,0,2,0,0,0,0,0,0,0,0,-,-,-,-,-,-,-,-,-,-,-,-,-,-,-,-,-,-
7.02151124975923E+017,https://twitter.com/CatalystCouncil/status/702151124975923200,"A shelter-neuter-return program and the association with cat health: Edinboro CH, Watson HN, F... https://t.co/OZmJZ1ZDq1 via @WinnFeline",2016-02-23 15:20 +0000,675,7,0.0103703704,1,0,0,1,4,0,1,0,0,0,0,0,0,0,0,-,-,-,-,-,-,-,-,-,-,-,-,-,-,-,-,-,-
7.01130593359282E+017,https://twitter.com/CatalystCouncil/status/701130593359282176,#LoveYourPetDay #Cats #Truth https://t.co/cuRZ8ZONjc,2016-02-20 19:45 +0000,591,8,0.013536379,3,0,2,0,3,0,0,0,0,0,0,0,0,0,0,-,-,-,-,-,-,-,-,-,-,-,-,-,-,-,-,-,-
7.01115525431173E+017,https://twitter.com/CatalystCouncil/status/701115525431173120,Happy #LoveYourPetDay! Why do you appreciate your #cat? Here are 21 excellent reasons they deserve the love: https://t.co/8tvFi3Udun,2016-02-20 18:45 +0000,41262,1546,0.0374678881,172,5,276,55,703,23,309,0,0,0,3,0,0,0,0,-,-,-,-,-,-,-,-,-,-,-,-,-,-,-,-,-,-
7.00865002304107E+017,https://twitter.com/CatalystCouncil/status/700865002304106496,RT @PetLiving: Why #cat parents shouldn't neglect wellness visits via @Petplan #pethealth #client https://t.co/Bp0dxivb8d,2016-02-20 02:10 +0000,539,3,0.0055658627,1,0,1,0,1,0,0,0,0,0,0,0,0,0,0,-,-,-,-,-,-,-,-,-,-,-,-,-,-,-,-,-,-
7.00818459089838E+017,https://twitter.com/CatalystCouncil/status/700818459089838080,Calming effects can also help #shelter cats RT @Pet360: Study | Music Designed for #Cats Appeals to Feline Listeners https://t.co/TkVHURSETx,2016-02-19 23:05 +0000,492,6,0.012195122,1,0,0,0,5,0,0,0,0,0,0,0,0,0,0,-,-,-,-,-,-,-,-,-,-,-,-,-,-,-,-,-,-
7.00773162028507E+017,https://twitter.com/CatalystCouncil/status/700773162028507136,"Spring brings new growth, especially of the baby variety. 7 strategies for #shelters to prepare for #kitten season: https://t.co/EjA42is6TS",2016-02-19 20:05 +0000,453,1,0.0022075055,0,0,0,0,1,0,0,0,0,0,0,0,0,0,0,-,-,-,-,-,-,-,-,-,-,-,-,-,-,-,-,-,-
7.00707982401667E+017,https://twitter.com/CatalystCouncil/status/700707982401667072,"Evaluating Palladia in cats with oral squamous cell carcinoma: Wiles V, Hohenhaus A, Lamb K, Z... https://t.co/GPDfHmrjjJ via @WinnFeline",2016-02-19 15:46 +0000,411,1,0.00243309,0,0,0,0,1,0,0,0,0,0,0,0,0,0,0,-,-,-,-,-,-,-,-,-,-,-,-,-,-,-,-,-,-
7.00092629485298E+017,https://twitter.com/CatalystCouncil/status/700092629485297665,Petey the cat found not one but two families to offer him dedicated love when he needed it the most: https://t.co/9aBat8bLKT #cats #Tampa,2016-02-17 23:01 +0000,450,3,0.0066666667,0,0,2,0,1,0,0,0,0,0,0,0,0,0,0,-,-,-,-,-,-,-,-,-,-,-,-,-,-,-,-,-,-
7.00048409311474E+017,https://twitter.com/CatalystCouncil/status/700048409311473664,Dinnertime just got a little more innovative with the No Mess Pet Dish: https://t.co/qSzCdzn84L https://t.co/R7jI5HEOIo,2016-02-17 20:05 +0000,362,4,0.0110497238,0,0,0,0,4,0,0,0,0,0,0,0,0,0,0,-,-,-,-,-,-,-,-,-,-,-,-,-,-,-,-,-,-
6.99628007787405E+017,https://twitter.com/CatalystCouncil/status/699628007787405312,"Evaluating a non-surgical deslorelin implant for sterility in tom cats: Romagnoli S, Baldan A,... https://t.co/v1Acn1IGgQ via @WinnFeline",2016-02-16 16:14 +0000,366,1,0.0027322404,0,0,0,0,1,0,0,0,0,0,0,0,0,0,0,-,-,-,-,-,-,-,-,-,-,-,-,-,-,-,-,-,-
6.990304042344E+017,https://twitter.com/CatalystCouncil/status/699030404234399745,5 treats that will have your feline Valentine meowing for more: https://t.co/Gymzm4WRPK,2016-02-15 00:40 +0000,358,0,0,0,0,0,0,0,0,0,0,0,0,0,0,0,0,0,-,-,-,-,-,-,-,-,-,-,-,-,-,-,-,-,-,-
6.98966207186235E+017,https://twitter.com/CatalystCouncil/status/698966207186235392,There's no better way to show your love on Valentine's Day than with a purrfect cat pun. https://t.co/mvSLielDbH https://t.co/BFCBwQEiSv,2016-02-14 20:25 +0000,346,4,0.0115606936,0,0,0,0,3,0,1,0,0,0,0,0,0,0,0,-,-,-,-,-,-,-,-,-,-,-,-,-,-,-,-,-,-
6.98645381605888E+017,https://twitter.com/CatalystCouncil/status/698645381605888001,Sharing isn't always caring: 6 foods to never feed your feline friends: https://t.co/8CzlNllCf1 https://t.co/mIRjQsOxbm,2016-02-13 23:10 +0000,393,15,0.0381679389,1,0,4,0,10,0,0,0,0,0,0,0,0,0,0,-,-,-,-,-,-,-,-,-,-,-,-,-,-,-,-,-,-
6.98621155385741E+017,https://twitter.com/CatalystCouncil/status/698621155385741314,So thankful caring and attentive neighbors RT @MeowMiya88: Brit banned from keeping animals after abandoning cat https://t.co/7y09hePReu,2016-02-13 21:33 +0000,382,7,0.0183246073,1,0,0,1,5,0,0,0,0,0,0,0,0,0,0,-,-,-,-,-,-,-,-,-,-,-,-,-,-,-,-,-,-
6.98600077154251E+017,https://twitter.com/CatalystCouncil/status/698600077154250752,Sweeten your Saturday with pictures of 37 people lucky enough to have the love of a cat: https://t.co/2Z9zSplemw https://t.co/q1DYo22UxT,2016-02-13 20:10 +0000,434,6,0.0138248848,3,0,1,0,1,0,0,0,0,0,1,0,0,0,0,-,-,-,-,-,-,-,-,-,-,-,-,-,-,-,-,-,-
6.98280712651346E+017,https://twitter.com/CatalystCouncil/status/698280712651345920,How much do you really know about your pet's dental health? Test and enhance your knowledge with the @AVMAvets quiz: https://t.co/E74XOpuJdp,2016-02-12 23:01 +0000,463,3,0.0064794816,2,0,1,0,0,0,0,0,0,0,0,0,0,0,0,-,-,-,-,-,-,-,-,-,-,-,-,-,-,-,-,-,-
6.98231434956431E+017,https://twitter.com/CatalystCouncil/status/698231434956431360,Show your furry Valentines how much you care for them with tips from this month's issue of It's All About the Cat! https://t.co/C09BZORYiR,2016-02-12 19:45 +0000,368,7,0.0190217391,1,0,1,0,2,0,3,0,0,0,0,0,0,0,0,-,-,-,-,-,-,-,-,-,-,-,-,-,-,-,-,-,-
6.98165265075278E+017,https://twitter.com/CatalystCouncil/status/698165265075277825,"Is it cardiac disease or not?  New bed-side test can help decide: Hezzell MJ, Rush JE, et al. ... https://t.co/Iziz6SOKRr via @WinnFeline",2016-02-12 15:22 +0000,1477,10,0.0067704807,2,0,0,2,4,0,2,0,0,0,0,0,0,0,0,-,-,-,-,-,-,-,-,-,-,-,-,-,-,-,-,-,-
6.97467653674398E+017,https://twitter.com/CatalystCouncil/status/697467653674397697,10 veterinary answers to those pressing questions about your feline friend's pearly whites: https://t.co/nvIQvyT93v,2016-02-10 17:10 +0000,263,0,0,0,0,0,0,0,0,0,0,0,0,0,0,0,0,0,-,-,-,-,-,-,-,-,-,-,-,-,-,-,-,-,-,-
6.97194592177955E+017,https://twitter.com/CatalystCouncil/status/697194592177954817,About 90% of #cats will have a dental problem in their lifetime. When and why your cat needs a dentist: https://t.co/eVzWAJCC9e,2016-02-09 23:05 +0000,222,0,0,0,0,0,0,0,0,0,0,0,0,0,0,0,0,0,-,-,-,-,-,-,-,-,-,-,-,-,-,-,-,-,-,-
6.97144260307657E+017,https://twitter.com/CatalystCouncil/status/697144260307656704,Felix proves a cat's work ethic and is named Head of Pest Control at Huddersfield station: https://t.co/uskbJk2LYr https://t.co/UQfGdtv3zP,2016-02-09 19:45 +0000,222,2,0.009009009,0,0,0,0,1,0,1,0,0,0,0,0,0,0,0,-,-,-,-,-,-,-,-,-,-,-,-,-,-,-,-,-,-
6.97104666920776E+017,https://twitter.com/CatalystCouncil/status/697104666920775680,"Castrating cats does not likely increase their risk for fatty liver disease: Vatolina C, Vaand... https://t.co/fVDRhjX4ZG via @WinnFeline",2016-02-09 17:07 +0000,213,0,0,0,0,0,0,0,0,0,0,0,0,0,0,0,0,0,-,-,-,-,-,-,-,-,-,-,-,-,-,-,-,-,-,-
6.96059578631459E+017,https://twitter.com/CatalystCouncil/status/696059578631458817,Blake was saved from a shelter &amp; returned the favor by alerting his new owner to a seizure: https://t.co/jCEee96leV https://t.co/nN4GuD8Jz6,2016-02-06 19:55 +0000,654,13,0.0198776758,4,0,5,0,4,0,0,0,0,0,0,0,0,0,0,-,-,-,-,-,-,-,-,-,-,-,-,-,-,-,-,-,-
6.95642828680987E+017,https://twitter.com/CatalystCouncil/status/695642828680986626,"Coat color and aggressive behaviors in cats: Stelow EA, Bain MJ, Kass PH. The relationship bet... https://t.co/x2igvts2dx via @WinnFeline",2016-02-05 16:19 +0000,248,3,0.0120967742,0,0,1,0,2,0,0,0,0,0,0,0,0,0,0,-,-,-,-,-,-,-,-,-,-,-,-,-,-,-,-,-,-
6.94973885276619E+017,https://twitter.com/CatalystCouncil/status/694973885276618753,Early diagnosis of heart disease is key to a positive prognosis. Know the signs your #cat may exhibit: https://t.co/FyS5yAe92O,2016-02-03 20:01 +0000,276,6,0.0217391304,1,0,1,0,4,0,0,0,0,0,0,0,0,0,0,-,-,-,-,-,-,-,-,-,-,-,-,-,-,-,-,-,-
6.9455178402766E+017,https://twitter.com/CatalystCouncil/status/694551784027660288,"Born to roam? Surveying cat owners about containment: McLeod LJ, Hine DW, Bentsen AJ. Born to ... https://t.co/HEabo0usrQ via @WinnFeline",2016-02-02 16:03 +0000,307,4,0.013029316,1,0,0,0,3,0,0,0,0,0,0,0,0,0,0,-,-,-,-,-,-,-,-,-,-,-,-,-,-,-,-,-,-
6.94290476472668E+017,https://twitter.com/CatalystCouncil/status/694290476472668166,RT @alleycatallies: Do you know what to do if you find kittens outdoors? https://t.co/RFYBHVz7ZG,2016-02-01 22:45 +0000,226,2,0.0088495575,0,0,1,0,1,0,0,0,0,0,0,0,0,0,0,-,-,-,-,-,-,-,-,-,-,-,-,-,-,-,-,-,-
6.94245150038573E+017,https://twitter.com/CatalystCouncil/status/694245150038573056,It's Pet Dental Health Month and time to establish good dental hygiene for your #cat: https://t.co/X6qWAtKQcA https://t.co/5m1POEDFtH,2016-02-01 19:45 +0000,1006,8,0.0079522863,5,0,0,0,3,0,0,0,0,0,0,0,0,0,0,-,-,-,-,-,-,-,-,-,-,-,-,-,-,-,-,-,-
6.93115426180506E+017,https://twitter.com/CatalystCouncil/status/693115426180505601,"Thyroid scintigraphy in cats with hyperthyroidism: Peterson ME, Broome MR.  Thyroid scintigrap... https://t.co/nQexOzDK5j via @WinnFeline",2016-01-29 16:56 +0000,219,0,0,0,0,0,0,0,0,0,0,0,0,0,0,0,0,0,-,-,-,-,-,-,-,-,-,-,-,-,-,-,-,-,-,-
6.92795636136186E+017,https://twitter.com/CatalystCouncil/status/692795636136185856,"They may feel like innocent play, but these 5 habits can be bothersome or even harmful to your #cat: https://t.co/pLWi9aEYHB",2016-01-28 19:45 +0000,332,14,0.0421686747,2,0,1,0,9,0,2,0,0,0,0,0,0,0,0,-,-,-,-,-,-,-,-,-,-,-,-,-,-,-,-,-,-
6.92483598725861E+017,https://twitter.com/CatalystCouncil/status/692483598725861376,Early detection provides better treatment and outcomes for #cats. Detect illness by knowing the signs and your pets: https://t.co/9sIN5qgTxw,2016-01-27 23:05 +0000,538,11,0.0204460967,2,0,3,0,3,0,3,0,0,0,0,0,0,0,0,-,-,-,-,-,-,-,-,-,-,-,-,-,-,-,-,-,-
6.92409431166947E+017,https://twitter.com/CatalystCouncil/status/692409431166947328,Know this risks when considering sharing the great outdoors with your feline friends: https://t.co/M7iLo4VePT https://t.co/Sn8zhSjSU1,2016-01-27 18:10 +0000,188,0,0,0,0,0,0,0,0,0,0,0,0,0,0,0,0,0,-,-,-,-,-,-,-,-,-,-,-,-,-,-,-,-,-,-
6.92157712596103E+017,https://twitter.com/CatalystCouncil/status/692157712596103170,"Banging on your car, honking your horn, and peeking under the hook could save a cat's life in colder temperatures: https://t.co/3XWkaUFiqi",2016-01-27 01:30 +0000,275,9,0.0327272727,2,0,1,1,5,0,0,0,0,0,0,0,0,0,0,-,-,-,-,-,-,-,-,-,-,-,-,-,-,-,-,-,-
6.92072091403883E+017,https://twitter.com/CatalystCouncil/status/692072091403882496,DIY outdoor cat shelter serves as refuge for neighborhood #cats combating the cold: https://t.co/98wy6ftjdb https://t.co/lbNH89EeHC,2016-01-26 19:50 +0000,207,13,0.0628019324,1,0,1,0,6,0,5,0,0,0,0,0,0,0,0,-,-,-,-,-,-,-,-,-,-,-,-,-,-,-,-,-,-
6.92017999922868E+017,https://twitter.com/CatalystCouncil/status/692017999922868225,"Looking at oclacitinib use in cats: Ortalda C, Noli C, et al.  Oclacitinib in feline nonflea-,... https://t.co/KeSiiLoq2s via @WinnFeline",2016-01-26 16:15 +0000,301,8,0.0265780731,2,0,1,0,3,0,2,0,0,0,0,0,0,0,0,-,-,-,-,-,-,-,-,-,-,-,-,-,-,-,-,-,-
6.91714710266315E+017,https://twitter.com/CatalystCouncil/status/691714710266314752,"What Resolutions did you make for your pets this year? @tabbyjamesco has three for a happier, healthier cat: https://t.co/TJTJ8gAMPw",2016-01-25 20:10 +0000,338,6,0.0177514793,1,0,1,0,4,0,0,0,0,0,0,0,0,0,0,-,-,-,-,-,-,-,-,-,-,-,-,-,-,-,-,-,-
6.90602318463635E+017,https://twitter.com/CatalystCouncil/status/690602318463635457,The Stranger Danger instinct is learned early on in #cats. When it is normal and when to address a fearful feline: https://t.co/0l6pybaM7c,2016-01-22 18:29 +0000,203,3,0.0147783251,0,0,0,0,3,0,0,0,0,0,0,0,0,0,0,-,-,-,-,-,-,-,-,-,-,-,-,-,-,-,-,-,-
6.90565726659187E+017,https://twitter.com/CatalystCouncil/status/690565726659186688,"More about spontaneous gastrointestinal perforations: Benardin F, Martinez L, et al. Spontaneo... https://t.co/5akYdWepZf via @WinnFeline",2016-01-22 16:04 +0000,184,0,0,0,0,0,0,0,0,0,0,0,0,0,0,0,0,0,-,-,-,-,-,-,-,-,-,-,-,-,-,-,-,-,-,-
6.90234428224868E+017,https://twitter.com/CatalystCouncil/status/690234428224868352,With great purr comes great responsibility. https://t.co/NG8V9J6c4Z,2016-01-21 18:08 +0000,166,1,0.0060240964,0,0,0,0,1,0,0,0,0,0,0,0,0,0,0,-,-,-,-,-,-,-,-,-,-,-,-,-,-,-,-,-,-
6.89484628462146E+017,https://twitter.com/CatalystCouncil/status/689484628462145536,"Mitoxantrone as adjuvant chemotherapy for mammary carcinomas in cats: Cunha SC, Corgozinho KB,... https://t.co/9D1fTOb00j via @WinnFeline",2016-01-19 16:28 +0000,186,1,0.0053763441,0,0,0,0,1,0,0,0,0,0,0,0,0,0,0,-,-,-,-,-,-,-,-,-,-,-,-,-,-,-,-,-,-
6.88131195419243E+017,https://twitter.com/CatalystCouncil/status/688131195419242496,"While I cannot argue with a cat's purrrfection, Mark Twain has clearly never heard a cat a minute past dinnertime. https://t.co/vRZXUCXIeA",2016-01-15 22:50 +0000,211,2,0.009478673,0,0,1,0,1,0,0,0,0,0,0,0,0,0,0,-,-,-,-,-,-,-,-,-,-,-,-,-,-,-,-,-,-
6.88031422800618E+017,https://twitter.com/CatalystCouncil/status/688031422800617472,"Assessing dexmedetomidine for inducing vomiting in cats: Thawley VJ, Drobatz KJ. Assessment of... https://t.co/RuEW4f3nbz via @WinnFeline",2016-01-15 16:14 +0000,247,2,0.008097166,1,0,0,0,1,0,0,0,0,0,0,0,0,0,0,-,-,-,-,-,-,-,-,-,-,-,-,-,-,-,-,-,-
6.87815263144776E+017,https://twitter.com/CatalystCouncil/status/687815263144775680,A house becomes a home when it is graced by a cat. https://t.co/DMBwK6lDSy,2016-01-15 01:55 +0000,169,2,0.0118343195,0,0,0,0,2,0,0,0,0,0,0,0,0,0,0,-,-,-,-,-,-,-,-,-,-,-,-,-,-,-,-,-,-
6.87727202230731E+017,https://twitter.com/CatalystCouncil/status/687727202230730753,21 words that mean something different when you have a #cat: https://t.co/LRJpqTkIol https://t.co/J8Pb4xCnHj,2016-01-14 20:05 +0000,168,9,0.0535714286,0,0,1,0,8,0,0,0,0,0,0,0,0,0,0,-,-,-,-,-,-,-,-,-,-,-,-,-,-,-,-,-,-
6.87033866436129E+017,https://twitter.com/CatalystCouncil/status/687033866436128768,Happy #KissAGingerDay! Don’t forget to celebrate by showing your ginger kitty some love 😽 https://t.co/yUf2ieIoCH,2016-01-12 22:10 +0000,244,4,0.0163934426,0,0,1,0,3,0,0,0,0,0,0,0,0,0,0,-,-,-,-,-,-,-,-,-,-,-,-,-,-,-,-,-,-
6.86946789514056E+017,https://twitter.com/CatalystCouncil/status/686946789514055680,"Evaluating meloxicam as a treatment for obstructive feline idiopathic cystitis: Dorsch R, Zell... https://t.co/bI77PTXAyT via @WinnFeline",2016-01-12 16:24 +0000,222,3,0.0135135135,0,0,0,0,3,0,0,0,0,0,0,0,0,0,0,-,-,-,-,-,-,-,-,-,-,-,-,-,-,-,-,-,-
6.86642561511993E+017,https://twitter.com/CatalystCouncil/status/686642561511993344,The coloring that makes your tux cat so dapper is also a key to understanding genetic diseases in humans: https://t.co/xVCuZlTUHJ,2016-01-11 20:15 +0000,196,2,0.0102040816,0,0,0,0,2,0,0,0,0,0,0,0,0,0,0,-,-,-,-,-,-,-,-,-,-,-,-,-,-,-,-,-,-
6.85552873627849E+017,https://twitter.com/CatalystCouncil/status/685552873627848706,Our first Newsletter of the year is ready &amp; waiting for you! Better understand your cat's needs for a Happy New Year https://t.co/033y8o0al1,2016-01-08 20:05 +0000,340,11,0.0323529412,2,0,1,1,5,0,2,0,0,0,0,0,0,0,0,-,-,-,-,-,-,-,-,-,-,-,-,-,-,-,-,-,-
6.85520964805722E+017,https://twitter.com/CatalystCouncil/status/685520964805722113,"More Feline Parmyxoviruses Discovered: Sieg M, Heenemann K, et al.  Discovery of new feline pa... https://t.co/jATEjMIFyl via @WinnFeline",2016-01-08 17:58 +0000,227,3,0.013215859,0,0,0,0,3,0,0,0,0,0,0,0,0,0,0,-,-,-,-,-,-,-,-,-,-,-,-,-,-,-,-,-,-
6.85186710414692E+017,https://twitter.com/CatalystCouncil/status/685186710414692353,"Cats are notoriously stoic, which means it's up to you to spot the signs of illness in your feline companions: https://t.co/WFiI0uxU6N",2016-01-07 19:50 +0000,230,8,0.0347826087,1,0,1,0,4,0,2,0,0,0,0,0,0,0,0,-,-,-,-,-,-,-,-,-,-,-,-,-,-,-,-,-,-
6.85145272414945E+017,https://twitter.com/CatalystCouncil/status/685145272414945280,January CATalysta: Craig Wallace https://t.co/XLpmXuDb39,2016-01-07 17:05 +0000,208,7,0.0336538462,1,0,0,0,3,0,3,0,0,0,0,0,0,0,0,-,-,-,-,-,-,-,-,-,-,-,-,-,-,-,-,-,-
6.84553763345035E+017,https://twitter.com/CatalystCouncil/status/684553763345035268,RT @AskTheCatDoctor: Feline Diabetes is a very real epidemic. Read about a vet’s experience with her own #cat. https://t.co/m5FWJHiyrk,2016-01-06 01:55 +0000,479,4,0.0083507307,1,0,0,0,3,0,0,0,0,0,0,0,0,0,0,-,-,-,-,-,-,-,-,-,-,-,-,-,-,-,-,-,-
6.84508491298509E+017,https://twitter.com/CatalystCouncil/status/684508491298508802,RT @onehealthdotorg: So important now that winter is here.  Keep your pets safe and healthy in the cold weather. https://t.co/kpEnTURwpV,2016-01-05 22:55 +0000,231,1,0.0043290043,0,0,1,0,0,0,0,0,0,0,0,0,0,0,0,-,-,-,-,-,-,-,-,-,-,-,-,-,-,-,-,-,-
6.84466967626035E+017,https://twitter.com/CatalystCouncil/status/684466967626035201,Great info for understanding and caring for deaf pets RT @Petplan: Deafness In Pets: What Pet Parents Need To Know https://t.co/WEjIUHnosu,2016-01-05 20:10 +0000,219,2,0.0091324201,0,0,1,0,1,0,0,0,0,0,0,0,0,0,0,-,-,-,-,-,-,-,-,-,-,-,-,-,-,-,-,-,-
6.84441880977912E+017,https://twitter.com/CatalystCouncil/status/684441880977911808,"RT @CATeditor: “Thank you for being a friend,” said the Berlin Zoo bear to his cat buddy. https://t.co/gu2ddFJqls",2016-01-05 18:30 +0000,199,0,0,0,0,0,0,0,0,0,0,0,0,0,0,0,0,0,-,-,-,-,-,-,-,-,-,-,-,-,-,-,-,-,-,-
6.84402014294389E+017,https://twitter.com/CatalystCouncil/status/684402014294388736,Does L-Lysine Supplementation Help Upper Respiratory Viral Infection in Cats? Probably Not.: B... https://t.co/LiogmR1du9 via @WinnFeline,2016-01-05 15:52 +0000,235,8,0.0340425532,0,0,0,1,4,0,3,0,0,0,0,0,0,0,0,-,-,-,-,-,-,-,-,-,-,-,-,-,-,-,-,-,-
6.84147672568168E+017,https://twitter.com/CatalystCouncil/status/684147672568168448,"Do you know how to spot possible feline hyperesthesia, or 'Twitchy Cat Syndrome,' and how to address it once you do? https://t.co/Qrse4yXCfr",2016-01-04 23:01 +0000,319,12,0.0376175549,2,0,3,1,6,0,0,0,0,0,0,0,0,0,0,-,-,-,-,-,-,-,-,-,-,-,-,-,-,-,-,-,-
6.84102255046463E+017,https://twitter.com/CatalystCouncil/status/684102255046463492,A bonded pair stays together thanks to a warmhearted adopter who welcomed both into her home https://t.co/6t2Dbll4WY https://t.co/E4Goc6uBQd,2016-01-04 20:01 +0000,179,4,0.0223463687,0,0,1,0,3,0,0,0,0,0,0,0,0,0,0,-,-,-,-,-,-,-,-,-,-,-,-,-,-,-,-,-,-
6.82695262758912E+017,https://twitter.com/CatalystCouncil/status/682695262758912001,"Celebrate another year past, a new year to come, and a safe pet at home with these 5 tips: https://t.co/6e78a522O4 https://t.co/ZbWt1woKN3",2015-12-31 22:50 +0000,371,5,0.0134770889,1,0,1,0,1,0,2,0,0,0,0,0,0,0,0,-,-,-,-,-,-,-,-,-,-,-,-,-,-,-,-,-,-
6.82611683899109E+017,https://twitter.com/CatalystCouncil/status/682611683899109376,"Compulsive wool-sucking in Siamese and Birman cats: Borns-Weil, Emmanuel C, Dodman N, et al. A... https://t.co/doMFI7F7Xc via @WinnFeline",2015-12-31 17:18 +0000,197,2,0.0101522843,0,0,0,0,0,0,2,0,0,0,0,0,0,0,0,-,-,-,-,-,-,-,-,-,-,-,-,-,-,-,-,-,-
6.82290254813E+017,https://twitter.com/CatalystCouncil/status/682290254812999680,Ever wonder how cats fit into the Star Wars universe? A Disney artist imagines the answer: https://t.co/9WbTygrHeJ https://t.co/fbbyAnCa12,2015-12-30 20:00 +0000,234,2,0.0085470085,0,0,0,0,1,0,1,0,0,0,0,0,0,0,0,-,-,-,-,-,-,-,-,-,-,-,-,-,-,-,-,-,-
6.81566600101818E+017,https://twitter.com/CatalystCouncil/status/681566600101818369,"2016 is nearly here and it's time to mark the date...on a hilarious #cat calendar, perhaps? https://t.co/hdXejVs1Md https://t.co/Wz493u5Ii1",2015-12-28 20:05 +0000,237,12,0.0506329114,0,0,0,0,4,0,5,0,0,0,0,0,0,3,3,-,-,-,-,-,-,-,-,-,-,-,-,-,-,-,-,-,-
6.81521935088353E+017,https://twitter.com/CatalystCouncil/status/681521935088353281,"Preventing undesirable behaviors in cats: Gazzano A, Bianchi L, Campa S, Mariti C. The prevent... https://t.co/g4xcgHxGJa via @WinnFeline",2015-12-28 17:07 +0000,218,1,0.004587156,0,0,0,0,1,0,0,0,0,0,0,0,0,0,0,-,-,-,-,-,-,-,-,-,-,-,-,-,-,-,-,-,-
6.80402967980282E+017,https://twitter.com/CatalystCouncil/status/680402967980281856,Thank you for sharing with us the gift of companion cat ownership this and every day! https://t.co/9wh6cFNEJG,2015-12-25 15:01 +0000,213,1,0.0046948357,0,0,1,0,0,0,0,0,0,0,0,0,0,0,0,-,-,-,-,-,-,-,-,-,-,-,-,-,-,-,-,-,-
6.8011452337476E+017,https://twitter.com/CatalystCouncil/status/680114523374759937,Cats are notorious peekers. But I think we’ve discovered the loophole to keeping them out of the Christmas tree! https://t.co/HUZg8lUJLK,2015-12-24 19:55 +0000,535,3,0.0056074766,0,0,1,0,2,0,0,0,0,0,0,0,0,0,0,-,-,-,-,-,-,-,-,-,-,-,-,-,-,-,-,-,-
6.80071866074071E+017,https://twitter.com/CatalystCouncil/status/680071866074071040,"A potential test determining survival times in cats with chronic kidney disease: Geddes RF, El... https://t.co/xuWkg2nNPW via @WinnFeline",2015-12-24 17:05 +0000,187,1,0.0053475936,0,0,0,0,1,0,0,0,0,0,0,0,0,0,0,-,-,-,-,-,-,-,-,-,-,-,-,-,-,-,-,-,-
6.80071747027268E+017,https://twitter.com/CatalystCouncil/status/680071747027267584,Felines want in on the festivities: a few tips to make the holidays special for your cat too https://t.co/thp8GIYih2 https://t.co/bE5Z1OEwJ6,2015-12-24 17:05 +0000,154,2,0.012987013,0,0,0,0,2,0,0,0,0,0,0,0,0,0,0,-,-,-,-,-,-,-,-,-,-,-,-,-,-,-,-,-,-
6.79392270383235E+017,https://twitter.com/CatalystCouncil/status/679392270383235073,"RT @DrAndyRoark: Is one of your #pets going under anesthesia? 

Ask your vet these 5 questions first &amp;gt; https://t.co/DDP2mViguj #cats",2015-12-22 20:05 +0000,199,2,0.0100502513,0,0,1,0,1,0,0,0,0,0,0,0,0,0,0,-,-,-,-,-,-,-,-,-,-,-,-,-,-,-,-,-,-
6.79367949476606E+017,https://twitter.com/CatalystCouncil/status/679367949476605952,"Amazon is basically Santa for cats, delivering beds and forts every day RT @VolVetHosp: The world’s best cat bed :) https://t.co/PrVGRRBhkr",2015-12-22 18:28 +0000,201,1,0.0049751244,0,0,0,0,1,0,0,0,0,0,0,0,0,0,0,-,-,-,-,-,-,-,-,-,-,-,-,-,-,-,-,-,-
6.79076449886855E+017,https://twitter.com/CatalystCouncil/status/679076449886855169,Special needs #kitten Tiny Tim receives a wheel chair from a local #SouthCarolina tech group https://t.co/FCr3HwTdnt https://t.co/3CWuPoxmEd,2015-12-21 23:10 +0000,226,6,0.0265486726,1,0,0,0,5,0,0,0,0,0,0,0,0,0,0,-,-,-,-,-,-,-,-,-,-,-,-,-,-,-,-,-,-
6.79027426450661E+017,https://twitter.com/CatalystCouncil/status/679027426450661380,RT @catladybox: You know you’re a cat lover if you know what this means: ELEVATOR BUTT! #catladydictionary https://t.co/ZV9cVZfexy,2015-12-21 19:55 +0000,162,5,0.0308641975,0,0,0,0,5,0,0,0,0,0,0,0,0,0,0,-,-,-,-,-,-,-,-,-,-,-,-,-,-,-,-,-,-
